{
  "created_at": "2026-10-22T06:51:33.628553+00:00",
  "dirty": "M openspec/easeus/reporting/config.json\n M playwright.config.js\n?? openspec/changes/",
  "feature_fingerprint": "72b4b1422216037a09bde37eb15a9e98918685dc5767ef873f8ca58c30fe3f65",
  "files": {
    "netlify/functions/_data.mjs": "6c81772c679cc12463251ed776a9666620257072c0216c6a239b774bc0c739e8",
    "netlify/functions/_prompt.mjs": "3a106370cf2b19a5476ad9b14eb5843e1ad9e8d189c24604595fc3555d7fb12d",
    "netlify/functions/_tools.mjs": "711b5f66cf24978c47a648699c436eaf7f6095bdd49165078cf4ee28ef6f5b33",
    "netlify/functions/chat.mjs": "db092a33a73df96ffdcfdfe87017fa15569567e7828a7a3763ca2dacb7587607",
    "netlify/functions/rate-limit.mjs": "ded0f94649a6b75220997a91111c60fb823d5a249aa2264f5ba34ce9dcabdaf2",
    "src/app.js": "06f5fd84648efdc920be706549bf7b2d964e1afcba2563d84528241b44b451a6",
    "src/browser-storage.js": "3be1ac1367ca3ba9d2343ef00e72e499d554973c3f4f68e0c43d96b68cb27d1d",
    "src/features/chat/index.js": "f24a567caa43e4819555c9897ea56808e9739bfde96760e93093b02f157b457a",
    "src/features/chat/settings.js": "db66d467e5eaa09060e7aaa26baeb72d6fa2dad464c50e887e1e74b88833604d",
    "src/features/chat/tools.js": "7ec1c3408177f5787fe3a950d738dc9fe23fc1bbd1d11ef67b8a1b48aca8e596",
    "src/features/chat/voice.js": "909884f883546353702cb4985af8d15ead591aa994d6699dbd62ad233c4379ea",
    "src/features/follow-teams/controller.js": "a6028ac6434501f879a55b65620fcfc6c9bc311208629783953f41c87b86ffbb",
    "src/features/follow-teams/matches.js": "74fb0602c9fdbc595628ad5ab4b81a9e7822bf7f8f0f10377a17a125fa0add5b",
    "src/features/follow-teams/state.js": "eff6b0353bc1d3937b73d730c61c209b652715efdb4fd81055594776800a9809",
    "src/features/follow-teams/view.js": "40e156a9a4c79cfd1a7b02bafbcbdaa3d0f9f4c37810f2b90a8e1a138eacbea8",
    "src/features/search/index.js": "c483acb97aaea3d49bed24ff8541663a3617cf4b26fd5197ed4abb17e38bf67c",
    "src/features/team-group-filter/controller.js": "8849b4de4c57120745e99284d6f6510201857a6514aa74e46e1dbb0cf9538541",
    "src/features/team-group-filter/state.js": "71f9501bd9e1429b284aaded35bad45dd924b5bdc99d302257c7f57fb2a45639",
    "src/i18n.js": "aafc881f05242aeb7f43c4dcbc8d2609b6ee23eb18ff8d9beb797fadca9ed88e",
    "src/router.js": "d1ca96cedcd0a88d6da73b86903a39fae928011a1f4bf955cd4fac46e15c9694",
    "src/shared/tournament-query/dataset.js": "c77c593697f7c9ed09a94187bff28a40354ccb05af49d9f9d9f41360b035b328",
    "src/shared/tournament-query/history.js": "857a52c5cb6b863c7680bd3a4887bee2f99baa48edc220ecc21106286d65b68e",
    "src/store.js": "73a32151b0e8d1af6224d8daec0cf1f394582ed97c9b0c27d79a2a057e474a72",
    "src/utils.js": "4a6e5e9095bb908f62ac719af23ac907bec8e49af15ecd46894ccee64313527c",
    "src/views/awards.js": "76ad5b69e283c783853a77c67107a8707ace3ea0e52d92135d432ee7d3cf5705",
    "src/views/bracket.js": "7e215c2f7a23e76cf120019ad535bf4f0c74629967482237f0d37dd74e661a04",
    "src/views/group-standings.js": "217649824df89c69b9dbe20a77a2b10d2ce172027c1dfb5016a4d12762b9f26f",
    "src/views/history.js": "5ceb552fc37f98178e5943181d3b9b7d697331db01ca87ba1556e52cd1e5a135",
    "src/views/home.js": "9ff75b184d46bb84e9f7bf1a31c988193d9f6a7478782f99826aa2a5bb38b47d",
    "src/views/match-detail.js": "6b8099924954aade628952dafb25e0c423203e05165777b69374ff6f424c9195",
    "src/views/not-found.js": "850e7ed4e4ca6523e3a9fd53e64228aa8b8c9c07c30289ec2d5810ee6bb59750",
    "src/views/schedule.js": "da02d305eeb88d8b8def465bdd5a981ddf8eb64a5e9223c2f1e94bc1c48577bd",
    "src/views/team-detail.js": "4416dc0ee6023af6f0102da9adabe4e1aaea29a2abd4d0ad7f508f246d57dbe3",
    "src/views/teams.js": "c23b36874e521cf9c3a2bd654ca62b83d5ca8f92023b9039f149dc352c1a56b9"
  },
  "head": "4ba4cc7d8818ddf7f8a53326d366db802e1462cb",
  "id": "066bebf607f043e2b95ce484c6fcec6a",
  "mode": "snapshot",
  "schema_version": 1,
  "source_commit": null
}
